{
  "$schema": "http://json-schema.org/draft-07/schema#",
  "$id": "https://github.com/phobos-dthorga/phobos-ostranauts/schemas/materials.schema.json",
  "title": "Phobos materials data pack",
  "type": "object",
  "additionalProperties": false,
  "properties": {
    "priority": {
      "type": "integer",
      "minimum": -100,
      "maximum": 100,
      "description": "Override files only: files apply lowest first (default 0), so a higher number has a later word. Leave it out unless you need it."
    },
    "schemaVersion": {
      "type": "integer",
      "const": 1
    },
    "schema": {
      "type": "string",
      "const": "materials"
    },
    "notes": {
      "type": "string",
      "description": "Free text for maintainers; ignored by the game."
    },
    "materials": {
      "type": "object",
      "additionalProperties": false,
      "patternProperties": {
        "^.+$": {
          "type": "object",
          "additionalProperties": false,
          "properties": {
            "notes": {
              "type": "string",
              "description": "Free text for maintainers; ignored by the game."
            },
            "kind": {
              "type": "string",
              "description": "How the mod builds it (stock, mined, packet, food, waste, ...)."
            },
            "kg": {
              "type": "number",
              "minimum": 0,
              "exclusiveMinimum": 0
            },
            "price": {
              "type": "number",
              "minimum": 0,
              "exclusiveMinimum": 0
            },
            "stack": {
              "type": "integer",
              "minimum": 1,
              "maximum": 1000
            },
            "side": {
              "type": "integer",
              "minimum": 1,
              "maximum": 8
            },
            "category": {
              "type": "string",
              "description": "Native market category condition, e.g. IsCategoryMetals."
            },
            "terminal": {
              "type": "boolean"
            },
            "art": {
              "type": "string"
            },
            "name": {
              "type": "string",
              "description": "Added materials only: the name shown when no translation names it."
            },
            "description": {
              "type": "string",
              "description": "Added materials only."
            },
            "image": {
              "type": "string",
              "pattern": "^[A-Za-z0-9_-][A-Za-z0-9_/-]*$",
              "description": "Added materials only: the picture, a path under an images folder without .png, such as myaddon/SteelNugget."
            }
          },
          "required": [
            "kg",
            "price"
          ]
        }
      },
      "description": "Loose items by definition id."
    }
  },
  "required": [
    "schemaVersion",
    "schema",
    "materials"
  ],
  "description": "Loose items a Phobos mod adds: mass, price, stack, footprint, category and art."
}
